{
  "$schema": "./debt-register.schema.json",
  "schemaVersion": "1.0.0",
  "project": "ResearchPath",
  "asOf": "2026-07-20",
  "statusVocabulary": [
    "open",
    "in_progress",
    "implemented_pending_verification",
    "blocked",
    "accepted",
    "closed"
  ],
  "items": [
    {
      "id": "ARCH-001",
      "category": "architecture",
      "priority": "P1",
      "title": "结构性拆分与入口可发现性",
      "status": "closed",
      "ownerRole": "architecture-maintainer",
      "targetMilestone": "M5-governance",
      "evidence": [
        "project.manifest.json",
        "docs/19-仓库结构与技术债治理.md",
        "scripts/check-architecture.ps1"
      ],
      "acceptance": [
        "领域路由、服务、R 引擎和前端模块职责分离",
        "架构检查阻止反向依赖和巨型文件回归"
      ],
      "closureEvidence": [
        "项目入口已登记到 project.manifest.json",
        "结构性债务状态和边界规则已形成文档与自动检查"
      ]
    },
    {
      "id": "PERF-001",
      "category": "performance",
      "priority": "P0",
      "title": "测试状态与正式工作区隔离",
      "status": "closed",
      "ownerRole": "quality-maintainer",
      "targetMilestone": "performance-A",
      "evidence": [
        "apps/api/tests/conftest.py",
        "docs/20-性能债审计与优化路线图.md"
      ],
      "acceptance": [
        "完整测试不向默认 .researchpath 工作区写入数据"
      ],
      "closureEvidence": [
        "pytest 使用临时 state_root",
        "复审抽样测试前后默认工作区文件数和字节数未变化"
      ]
    },
    {
      "id": "PERF-002",
      "category": "performance",
      "priority": "P0",
      "title": "草稿预检缓存与统计签名",
      "status": "closed",
      "ownerRole": "modeling-maintainer",
      "targetMilestone": "performance-B",
      "evidence": [
        "apps/api/app/services/model_service.py",
        "apps/api/tests"
      ],
      "acceptance": [
        "只修改画布坐标或显示信息时不读取 Parquet",
        "相同数据、测量版本和统计签名的重复预检命中缓存",
        "完整测试门禁通过"
      ],
      "closureEvidence": [
        "scripts/test.ps1: API 90 tests passed",
        "apps/api/tests/test_model_validation.py: precheck cache isolation and repeated validation coverage"
      ]
    },
    {
      "id": "PERF-003",
      "category": "performance",
      "priority": "P1",
      "title": "任务状态、结果、进度和大矩阵展示瘦身",
      "status": "closed",
      "ownerRole": "fullstack-maintainer",
      "targetMilestone": "performance-D-E",
      "evidence": [
        "apps/api/app/api/routes/analyses.py",
        "apps/web/src/components/empirical/VirtualizedCorrelationTable.tsx",
        "docs/20-性能债审计与优化路线图.md"
      ],
      "acceptance": [
        "正式 ResultBundle 只有一个权威副本",
        "进度支持 SSE 且刷新后可恢复",
        "200×200 矩阵只渲染视口范围",
        "生产构建满足 bundle budget"
      ],
      "closureEvidence": [
        "scripts/test.ps1: API 90 tests, web 12 tests, typecheck and production build passed",
        "apps/web/src/components/empirical/VirtualizedCorrelationTable.tsx: viewport row/column virtualization"
      ]
    },
    {
      "id": "PERF-004",
      "category": "performance",
      "priority": "P0",
      "title": "多进程 Bootstrap、平行分析与常驻 R Worker",
      "status": "closed",
      "ownerRole": "statistical-engine-maintainer",
      "targetMilestone": "performance-F",
      "evidence": [
        "engine/R/lib/parallel.R",
        "engine/R/worker.R",
        "apps/api/app/services/r_workers.py",
        "apps/api/tests/test_r_parallel_runtime.py",
        "scripts/benchmark-r-runtime.py",
        "output/performance/r-runtime-baseline.json"
      ],
      "acceptance": [
        "重负载基准相对单进程达到目标 3–4 倍提速，或记录可解释的硬件上限",
        "相同引擎版本和种子在单核与多核下结果一致",
        "常驻 1–2 个 Worker 消除重复 R 包冷启动",
        "取消、超时、Worker 崩溃替换和 Rscript 回退经过自动测试",
        "连续运行无孤儿进程、句柄和临时目录增长",
        "完整架构、R lock、统计金标准和应用测试通过"
      ],
      "closureEvidence": [
        "output/performance/r-runtime-baseline.json: benchmark passed; heavy bootstrap speedup 4.162x; numericEquivalent=true",
        "apps/api/tests/test_r_parallel_runtime.py: worker reuse, crash replacement, cancellation replacement and concurrency tests passed"
      ]
    },
    {
      "id": "PERF-005",
      "category": "performance",
      "priority": "P1",
      "title": "问卷实证任务化与相关矩阵去重",
      "status": "closed",
      "ownerRole": "empirical-analysis-maintainer",
      "targetMilestone": "performance-C",
      "evidence": [
        "engine/R/run_empirical_analysis.R",
        "docs/20-性能债审计与优化路线图.md"
      ],
      "acceptance": [
        "超过一秒的实证分析统一返回任务 ID，并支持进度、取消和恢复",
        "相关矩阵只计算上三角并镜像，结果在既定容差内等价",
        "任务队列有明确容量和资源预算"
      ],
      "closureEvidence": [
        "scripts/test.ps1: API 90 tests passed",
        "apps/api/tests/test_empirical_center.py: queued execution, cancellation, recovery and segmented result access covered"
      ]
    },
    {
      "id": "GOV-001",
      "category": "version-and-delivery",
      "priority": "P0",
      "title": "Git 基线、持续集成与发布证据",
      "status": "blocked",
      "ownerRole": "release-maintainer",
      "targetMilestone": "foundation-0",
      "evidence": [
        "docs/21-长期可持续开发债务复审与治理基线.md"
      ],
      "acceptance": [
        "存在经过审计且可回滚的首个基线提交",
        "CI 自动执行架构、格式、类型、契约、Python、R、前端和构建门禁",
        "发布证据包含提交、环境、测试、基准和校验值"
      ],
      "closureEvidence": [
        "c63797d: Establish audited ResearchPath baseline",
        ".github/workflows/ci.yml: pinned GitHub Actions quality gate and evidence artifact",
        "origin=https://github.com/linkingoscar/nicetry.git；2026-07-17 的 `ResearchPath quality gate` 已在提交 35df563 上触发",
        "GitHub 对当前私有仓库的分支保护 API 返回 HTTP 403（需 GitHub Pro 或将仓库公开），因此 required-check 规则仍由平台套餐阻塞"
      ]
    },
    {
      "id": "DATA-001",
      "category": "data-migration-and-integrity",
      "priority": "P0",
      "title": "数据库迁移、外键、完整性与备份恢复",
      "status": "closed",
      "ownerRole": "data-lifecycle-maintainer",
      "targetMilestone": "foundation-1",
      "evidence": [
        "apps/api/app/services/dataset_repository.py",
        "docs/21-长期可持续开发债务复审与治理基线.md"
      ],
      "acceptance": [
        "SQLite user_version 和迁移注册表生效",
        "所有连接启用外键并通过悬空引用测试",
        "旧版本 fixture 可逐版本迁移且迁移幂等",
        "备份、恢复、SHA-256 校验和异常退出演练通过"
      ],
      "closureEvidence": [
        "scripts/test.ps1: migration, foreign-key and backup/restore test suites passed",
        "apps/api/tests/test_database_migrations.py and test_workspace_archive.py: migration and recovery coverage passed"
      ]
    },
    {
      "id": "SEC-001",
      "category": "security-and-privacy",
      "priority": "P0",
      "title": "本地修改接口和表格导出安全",
      "status": "closed",
      "ownerRole": "security-maintainer",
      "targetMilestone": "foundation-1",
      "evidence": [
        "apps/api/app/api/routes",
        "apps/api/app/services/empirical_export.py",
        "docs/21-长期可持续开发债务复审与治理基线.md"
      ],
      "acceptance": [
        "修改接口要求启动时随机会话令牌",
        "Excel/CSV 用户文本对 =、+、-、@、制表符和回车实施统一公式注入保护",
        "上传文件有大小、展开资源和危险内容边界测试"
      ],
      "closureEvidence": [
        "apps/api/tests/test_security_controls.py: session token, formula-injection and safe-relative-path boundaries passed",
        "apps/api/tests/test_dataset_import.py: upload size, archive and dangerous-content boundaries passed"
      ]
    },
    {
      "id": "SEC-002",
      "category": "security-and-privacy",
      "priority": "P0",
      "title": "恢复、导出与持久化路径的统一边界",
      "status": "closed",
      "ownerRole": "security-maintainer",
      "targetMilestone": "security-path-boundary",
      "evidence": [
        "docs/audits/2026-07-15-security-review/findings",
        "apps/api/app/services/repository_io.py",
        "apps/api/app/services/dataset_repository.py",
        "apps/api/app/services/export_bundle.py",
        "apps/api/app/services/analysis_repository.py"
      ],
      "acceptance": [
        "所有从 SQLite、状态 JSON 和归档成员得到的路径均通过共享安全路径值和预期对象身份校验",
        "原始 8 项持久化路径/身份证据路径在错误输入下均在文件副作用前失败",
        "旧项目 unsafe path 具有可解释的迁移错误或已证明的安全迁移证据"
      ],
      "closureEvidence": [
        "apps/api/tests/test_security_controls.py: portable capability path boundaries passed",
        "apps/api/app/services/{dataset_repository,analysis_repository,export_bundle}.py: persisted path and object-identity guards implemented; post-fix security re-scan remains required"
      ]
    },
    {
      "id": "SEC-003",
      "category": "security-and-privacy",
      "priority": "P1",
      "title": "归档资源预算、备份绑定与清理安全",
      "status": "closed",
      "ownerRole": "security-maintainer",
      "targetMilestone": "security-archive-boundary",
      "evidence": [
        "docs/audits/2026-07-15-security-review/findings",
        "apps/api/app/services/repository_io.py",
        "apps/api/app/services/workspace_archive.py",
        "apps/api/app/services/workspace_maintenance.py"
      ],
      "acceptance": [
        "归档成员数、压缩后字节、单成员展开字节、总展开字节和压缩比在解压前受限",
        "备份清单与审计数据库/文件快照绑定并通过恢复演练",
        "清理目标严格排除 state_root、要求准确的 approved parent，并拒绝 reparse point"
      ],
      "closureEvidence": [
        "apps/api/tests/test_workspace_archive.py: backup verify, isolated restore, traversal and Windows-rooted member tests passed",
        "apps/api/tests/test_workspace_maintenance.py: audited cleanup and backup binding tests passed"
      ]
    },
    {
      "id": "CONTRACT-001",
      "category": "contracts-and-types",
      "priority": "P1",
      "title": "API 响应契约与宽泛类型收敛",
      "status": "closed",
      "ownerRole": "api-contract-maintainer",
      "targetMilestone": "foundation-2",
      "evidence": [
        "apps/api/app/api/routes",
        "apps/web/src/types/generated-api.ts",
        "specs"
      ],
      "acceptance": [
        "公开 API 均声明响应契约或有明确豁免",
        "JSON Schema、Python、OpenAPI 和 TypeScript 漂移门禁通过",
        "静态类型基线阻止新增未经说明的 Any"
      ],
      "closureEvidence": [
        "scripts/generate-contracts.ps1 -Check: OpenAPI and TypeScript generation current",
        "scripts/check-python-types.py and Full Harness: contract/type gates passed"
      ]
    },
    {
      "id": "QA-001",
      "category": "testing-and-validation",
      "priority": "P1",